{
  "discografia": [],
  "videos": [
    "https://youtu.be/wAbIWZDkLfI?si=0QdpVLBpnrSQZi2e&utm_source=ZTQxO",
    "https://youtu.be/vvlKZTNS0vk?si=9Uu1gKqmc2gzLvfj&utm_source=ZTQxO",
    "https://youtu.be/z3r1x6VjmOU?si=5vxxPT42jY3WQTiC&utm_source=ZTQxO"],
  "formacoesAntigas": [],
  "premios": [],
  "letrasDestacadas": [],
  "curiosidades": [],
  "ultimaAtualizacao": null,
  "fontes": []
}
