{
  "discografia": [],
  "videos": [],
  "formacoesAntigas": [],
  "premios": [],
  "letrasDestacadas": [],
  "curiosidades": [
    "Foi durante uma conversa no WhatsApp, queríamos algum nome que combinasse com o ambiente que o Doom trás e foi dada a ideia de usar Funesta, que é algo que trás a ideia de morte."
  ],
  "ultimaAtualizacao": null,
  "fontes": []
}
