{
  "discografia": [],
  "videos": [
    "https://www.youtube.com/watch?v=p9weEhh7NZI",
    "https://www.youtube.com/watch?v=fOC_wjnUKAY"
  ],
  "formacoesAntigas": [],
  "premios": [],
  "letrasDestacadas": [],
  "curiosidades": [
    "O lendário baixo Sonelli foi adquirido numa troca por 3 sacos de cimento, em meados de 2002.",
    "24 anos na ativa, sem pausas, sem interrupções."
  ],
  "ultimaAtualizacao": null,
  "fontes": []
}
