{
  "discografia": [],
  "videos": [
    "https://www.youtube.com/watch?v=8dZVkyGVaG0&list=OLAK5uy_nDdb9HcdIij-S3DC6zvMg4AASreqrR7bs",
    "https://www.youtube.com/watch?v=Y6uGtlZPn_s&list=OLAK5uy_n3bEhf4-RCBy-nw37Ifupy-CfUWaM315M"
  ],
  "formacoesAntigas": [],
  "premios": [],
  "letrasDestacadas": [],
  "curiosidades": [],
  "ultimaAtualizacao": null,
  "fontes": []
}
